mysqld --skip-grant-tables

mysql -u root -p


----------------------------------------------------------------

C:\Program Files\MySQL\MySQL Server 8.0\bin>net stop MySQL80
MySQL80 サービスを停止中です...
MySQL80 サービスは正常に停止されました。

C:\Program Files\MySQL\MySQL Server 8.0\bin>net start MySQL80
MySQL80 サービスを開始します...
MySQL80 サービスは正常に開始されました。


----------------------------------------------------------------

Type 'help;' or '\h' for help. Type '\c' to clear the current input statement.


----------------------------------------------------------------

mysql> show databases;
mysql> USE hoge;


mysql> CREATE TABLE users(id INT AUTO_INCREMENT,
    -> name TEXT,
    -> gender TEXT,
    -> email TEXT,PRIMARY KEY(id));
Query OK, 0 rows affected (1.37 sec)


mysql> show tables;
+----------------+
| Tables_in_hoge |
+----------------+
| users          |
+----------------+
1 row in set (0.08 sec)



mysql> describe users;
+--------+------+------+-----+---------+----------------+
| Field  | Type | Null | Key | Default | Extra          |
+--------+------+------+-----+---------+----------------+
| id     | int  | NO   | PRI | NULL    | auto_increment |
| name   | text | YES  |     | NULL    |                |
| gender | text | YES  |     | NULL    |                |
| email  | text | YES  |     | NULL    |                |
+--------+------+------+-----+---------+----------------+
4 rows in set (0.05 sec)


mysql> INSERT INTO users VALUES (
    -> 1,
    -> "Taro",
    -> "male",
    -> "taro@gmail.com");
Query OK, 1 row affected (0.09 sec)



----------------------------------------------------------------

mysql> INSERT INTO users VALUES(2,
    -> "Hanako",
    -> "female",
    -> "hanako@gamil.com");
Query OK, 1 row affected (0.10 sec)

mysql> SELECT * FROM users;
+----+--------+--------+------------------+
| id | name   | gender | email            |
+----+--------+--------+------------------+
|  1 | Taro   | male   | taro@gmail.com   |
|  2 | Hanako | female | hanako@gamil.com |
+----+--------+--------+------------------+
2 rows in set (0.00 sec)



----------------------------------------------------------------

mysql> UPDATE users set gender = "male" where id = 1;
Query OK, 0 rows affected (0.01 sec)
Rows matched: 1  Changed: 0  Warnings: 0

mysql> SELECT * FROM users;
+----+--------+--------+------------------+
| id | name   | gender | email            |
+----+--------+--------+------------------+
|  1 | Taro   | male   | taro@gmail.com   |
|  2 | Hanako | female | hanako@gamil.com |
+----+--------+--------+------------------+
2 rows in set (0.00 sec)


----------------------------------------------------------------

mysql> DELETE FROM users WHERE id = 1;
Query OK, 1 row affected (0.05 sec)

mysql> SELECT * from users;
+----+--------+--------+------------------+
| id | name   | gender | email            |
+----+--------+--------+------------------+
|  2 | Hanako | female | hanako@gamil.com |
+----+--------+--------+------------------+
1 row in set (0.00 sec)


----------------------------------------------------------------

mysql> DROP TABLE users;
Query OK, 0 rows affected (0.86 sec)








